[
 {
  "slug": "ansol",
  "name": "ANSOL",
  "website": "https://ansol.vn",
  "careers_url": "https://ansol.vn/vi/careers",
  "group": "A",
  "hq": "Hà Nội / TP.HCM",
  "remote_policy": "Remote-first; Backend \"Hà Nội / Từ xa\", ML/AI \"TP.HCM / Từ xa\"; DevOps \"Hà Nội / Kết hợp\"",
  "vn_hiring_mode": "Trực tiếp",
  "hires_roles": [
   "devops",
   "backend",
   "ml"
  ],
  "timezone_note": "Giờ VN",
  "salary_public": "Chưa công bố",
  "source_urls": [
   "https://ansol.vn/vi/careers"
  ],
  "verified": true,
  "last_checked": "2026-10-26"
 },
 {
  "slug": "asiantech",
  "name": "Asian Technology Solutions",
  "website": "https://www.asiantech.vn",
  "careers_url": "https://www.asiantech.vn",
  "group": "A",
  "hq": "Việt Nam",
  "remote_policy": "100% remote (freelance 2 tháng)",
  "vn_hiring_mode": "Freelance",
  "hires_roles": [
   "devops",
   "azure"
  ],
  "timezone_note": "Giờ VN",
  "salary_public": "Tới 55 triệu VND",
  "source_urls": [
   "https://itviec.com"
  ],
  "verified": false,
  "last_checked": "2026-10-26"
 },
 {
  "slug": "ateam-vn",
  "name": "Ateam Việt Nam",
  "website": "https://www.a-tm.co.jp",
  "careers_url": "https://itviec.com/companies/ateam-viet-nam",
  "group": "A",
  "hq": "TP.HCM (công ty mẹ Nhật)",
  "remote_policy": "Remote; phải sống gần TP.HCM",
  "vn_hiring_mode": "Trực tiếp",
  "hires_roles": [
   "game-dev"
  ],
  "timezone_note": "Giờ VN/Nhật",
  "salary_public": "Tới 2.000 USD",
  "source_urls": [
   "https://itviec.com/it-jobs/remote"
  ],
  "verified": true,
  "last_checked": "2026-10-28"
 },
 {
  "slug": "cloudx",
  "name": "CloudX (Công ty CP CloudX)",
  "website": "https://cloudx.com.vn",
  "careers_url": "https://cloudx.com.vn/tin-tuc/tuyen-dung",
  "group": "A",
  "hq": "Hà Nội",
  "remote_policy": "Tin DevOps \"remote 100%\" và Senior SysAdmin remote",
  "vn_hiring_mode": "Trực tiếp",
  "hires_roles": [
   "devops",
   "sysadmin"
  ],
  "timezone_note": "Giờ VN",
  "salary_public": "Chưa công bố",
  "source_urls": [
   "https://cloudx.com.vn/tin-tuc/tuyen-dung"
  ],
  "verified": true,
  "last_checked": "2026-10-28"
 },
 {
  "slug": "coderpush",
  "name": "CoderPush",
  "website": "https://coderpush.com",
  "careers_url": "https://coderpush.com",
  "group": "A",
  "hq": "TP.HCM",
  "remote_policy": "Tự nhận remote-first, văn phòng HN/HCM tùy chọn; tin DevOps hiện tại là hybrid Hà Nội",
  "vn_hiring_mode": "Trực tiếp",
  "hires_roles": [
   "devops",
   "cloud",
   "backend",
   "ai"
  ],
  "timezone_note": "Giờ VN",
  "salary_public": "Tới 90 triệu gross (vị trí AI Python senior)",
  "source_urls": [
   "https://www.linkedin.com/jobs/view/4477562579"
  ],
  "verified": true,
  "last_checked": "2026-10-26"
 },
 {
  "slug": "devwork",
  "name": "Devwork",
  "website": "https://devwork.vn",
  "careers_url": "https://devwork.vn",
  "group": "A",
  "hq": "Việt Nam (nền tảng tuyển dụng)",
  "remote_policy": "100% remote",
  "vn_hiring_mode": "Qua nền tảng",
  "hires_roles": [
   "devops",
   "azure"
  ],
  "timezone_note": "Giờ VN",
  "salary_public": "30-40 triệu VND (~1.200-1.600 USD)",
  "source_urls": [
   "https://devwork.vn"
  ],
  "verified": false,
  "last_checked": "2026-10-26"
 },
 {
  "slug": "dikshatek",
  "name": "Dikshatek (VN)",
  "website": null,
  "careers_url": "https://himalayas.app/companies/dikshatek-vn",
  "group": "A",
  "hq": "Việt Nam (theo Himalayas)",
  "remote_policy": "Tin \"Remote DevOps\"; LinkedIn có tin \"[HCM - HYBRID]\"",
  "vn_hiring_mode": "Trực tiếp (chưa xác minh)",
  "hires_roles": [
   "devops",
   "data"
  ],
  "timezone_note": "Giờ VN",
  "salary_public": "Chưa công bố",
  "source_urls": [
   "https://himalayas.app/companies/dikshatek-vn/jobs/remote-devops-engineer",
   "https://himalayas.app/companies/dikshatek-co/jobs/senior-devops_remote-job"
  ],
  "verified": true,
  "last_checked": "2026-10-26"
 },
 {
  "slug": "dwarves",
  "name": "Dwarves Foundation",
  "website": "https://d.foundation",
  "careers_url": "https://memo.d.foundation/careers",
  "group": "A",
  "hq": "TP.HCM",
  "remote_policy": "Remote-friendly (văn phòng HCM/HN/Đà Lạt)",
  "vn_hiring_mode": "Trực tiếp",
  "hires_roles": [
   "platform",
   "backend"
  ],
  "timezone_note": "Giờ VN",
  "salary_public": "Chưa công bố",
  "source_urls": [
   "https://memo.d.foundation/careers"
  ],
  "verified": true,
  "last_checked": "2026-10-28"
 },
 {
  "slug": "edgecraft",
  "name": "Edgecraft Digital Việt Nam",
  "website": "https://edgecraft.digital",
  "careers_url": "https://www.linkedin.com/company/edgecraft-digital",
  "group": "A",
  "hq": "Việt Nam",
  "remote_policy": "\"Remote work within Vietnam\"",
  "vn_hiring_mode": "Trực tiếp (fractional)",
  "hires_roles": [
   "cloud",
   "architect"
  ],
  "timezone_note": "Giờ VN",
  "salary_public": "Chưa công bố",
  "source_urls": [
   "https://www.linkedin.com/jobs/search?keywords=Edgecraft%20Digital"
  ],
  "verified": true,
  "last_checked": "2026-10-26"
 },
 {
  "slug": "elca-vn",
  "name": "ELCA Vietnam",
  "website": "https://www.elca.ch",
  "careers_url": "https://careers.elca.ch",
  "group": "A",
  "hq": "TP.HCM (tập đoàn Thụy Sĩ)",
  "remote_policy": "Hybrid",
  "vn_hiring_mode": "Trực tiếp",
  "hires_roles": [
   "devops",
   "platform"
  ],
  "timezone_note": "Giờ VN, khách Thụy Sĩ",
  "salary_public": "Chưa công bố",
  "source_urls": [
   "https://careers.elca.ch"
  ],
  "verified": false,
  "last_checked": "2026-10-26"
 },
 {
  "slug": "fizen",
  "name": "FIZEN",
  "website": "https://fizen.io",
  "careers_url": "https://itviec.com/companies/fizen",
  "group": "A",
  "hq": "Hà Nội / TP.HCM",
  "remote_policy": "Remote ở HN/HCM (theo tin ITviec)",
  "vn_hiring_mode": "Trực tiếp",
  "hires_roles": [
   "ba",
   "product"
  ],
  "timezone_note": "Giờ VN",
  "salary_public": "Tới 1.500 USD (BA)",
  "source_urls": [
   "https://itviec.com/it-jobs/remote"
  ],
  "verified": true,
  "last_checked": "2026-10-28"
 },
 {
  "slug": "fram",
  "name": "fram^",
  "website": "https://fram.vn",
  "careers_url": "https://itviec.com/companies/fram",
  "group": "A",
  "hq": "TP.HCM (chủ sở hữu Thụy Điển)",
  "remote_policy": "Remote cho vị trí SRE; Senior DevOps ghi \"flexible remote\"",
  "vn_hiring_mode": "Trực tiếp",
  "hires_roles": [
   "sre",
   "devops"
  ],
  "timezone_note": "Giờ VN, khách hàng EU",
  "salary_public": "Chưa công bố",
  "source_urls": [
   "https://www.linkedin.com/jobs/view/4475677848",
   "https://itviec.com/it-jobs/remote"
  ],
  "verified": true,
  "last_checked": "2026-10-28"
 },
 {
  "slug": "gradion",
  "name": "Gradion (trước là NFQ Vietnam)",
  "website": "https://gradion.com",
  "careers_url": "https://jobs.lever.co/gradion",
  "group": "A",
  "hq": "TP.HCM / Đức",
  "remote_policy": "Hybrid; ứng viên ở Hà Nội hoặc Cần Thơ được làm remote",
  "vn_hiring_mode": "Trực tiếp",
  "hires_roles": [
   "devops",
   "backend"
  ],
  "timezone_note": "9:00-18:00 VN + on-call theo ca cho khách EU",
  "salary_public": "Chưa công bố; thưởng tới 2 tháng lương",
  "source_urls": [
   "https://jobs.lever.co/gradion/b67e9d22-2494-4a9f-8aa8-6496e927c593"
  ],
  "verified": true,
  "last_checked": "2026-10-31"
 },
 {
  "slug": "gtemas",
  "name": "GTEMAS",
  "website": "https://gtemas.com",
  "careers_url": "https://gtemas.com/careers",
  "group": "A",
  "hq": "Hà Nội / TP.HCM / Đà Nẵng",
  "remote_policy": "Hybrid & remote; nhiều vị trí \"Vietnam (Remote/Hybrid)\"",
  "vn_hiring_mode": "Hợp đồng/full-time",
  "hires_roles": [
   "devops",
   "backend"
  ],
  "timezone_note": "Khách US/EU/APAC",
  "salary_public": "Chưa công bố",
  "source_urls": [
   "https://gtemas.com/careers",
   "https://gtemas.com/careers/senior-devops-engineer"
  ],
  "verified": true,
  "last_checked": "2026-10-26"
 },
 {
  "slug": "hatonet",
  "name": "Hatonet",
  "website": "https://hatonet.com",
  "careers_url": "https://hatonet.com",
  "group": "A",
  "hq": "Việt Nam",
  "remote_policy": "Remote",
  "vn_hiring_mode": "Qua nền tảng",
  "hires_roles": [
   "devops"
  ],
  "timezone_note": "Giờ VN",
  "salary_public": "Tới 32 triệu VND",
  "source_urls": [
   "https://hatonet.com"
  ],
  "verified": false,
  "last_checked": "2026-10-26"
 },
 {
  "slug": "holistics",
  "name": "Holistics",
  "website": "https://www.holistics.io",
  "careers_url": "https://www.holistics.io/careers/",
  "group": "A",
  "hq": "Singapore / TP.HCM (đội kỹ thuật ở VN)",
  "remote_policy": "Hybrid WFO+WFH; các vị trí remote theo giờ Mỹ",
  "vn_hiring_mode": "Trực tiếp",
  "hires_roles": [
   "backend",
   "data"
  ],
  "timezone_note": "Vị trí remote cần giờ Mỹ",
  "salary_public": "Chưa công bố",
  "source_urls": [
   "https://www.holistics.io/careers/"
  ],
  "verified": true,
  "last_checked": "2026-10-26"
 },
 {
  "slug": "ikonnect",
  "name": "iKonnect (agency)",
  "website": "https://www.ikonnectvn.com",
  "careers_url": "https://www.ikonnectvn.com",
  "group": "A",
  "hq": "Việt Nam (agency)",
  "remote_policy": "Fully remote cho ứng viên ở châu Á; overlap 1-2 giờ/ngày với Mỹ",
  "vn_hiring_mode": "Qua agency (contractor)",
  "hires_roles": [
   "devops",
   "blockchain"
  ],
  "timezone_note": "Overlap 1-2h với Mỹ",
  "salary_public": "\"Competitive\"",
  "source_urls": [
   "https://www.ikonnectvn.com/jobs/devops-engineer-blockchain-contractor-jo322"
  ],
  "verified": true,
  "last_checked": "2026-10-28"
 },
 {
  "slug": "jt1",
  "name": "JT1 (agency)",
  "website": "https://jt1.vn",
  "careers_url": "https://jt1.vn",
  "group": "A",
  "hq": "TP.HCM (agency tuyển dụng)",
  "remote_policy": "Vị trí remote theo giờ VN",
  "vn_hiring_mode": "Qua agency",
  "hires_roles": [
   "platform",
   "devops"
  ],
  "timezone_note": "Giờ VN",
  "salary_public": "2.000-2.500 USD (OVD273)",
  "source_urls": [
   "https://jt1.vn"
  ],
  "verified": false,
  "last_checked": "2026-10-26"
 },
 {
  "slug": "kms-tech",
  "name": "KMS Technology",
  "website": "https://kms-technology.com",
  "careers_url": "https://kms-technology.com/careers",